{"backend":{"backend_version":"0.3","claims_format":"0.2","end_to_end_eligible":true,"endpoint":"restricted_source","excluded_surfaces":["any host interpreter, ordinary Lean code generation, VM, compiler, linker, loader, operating-system service or native executable that might later execute the source","mutable state, unrestricted recursion, I/O, concurrency and fairness","constant-time claims and physical time, memory or other resources","machine-width arithmetic","natural-language-to-contract fidelity (a declared interpretation boundary)"],"id":"verislop.backend.vscore/0.3","language":"vscore/0.3","limitations":["one delivered source, one selected prepared direct accepted-contract bridge","each entry binds one-to-one to an accepted symbol; value-used endpoints prove universal refinement and source-only endpoints prove exact typed-entry and observation requirements","every required implementation guarantee is covered; native Python facets require an explicit new delivery contract","opaque statements, liveness, physical resources and required runtime campaigns are unsupported"],"producers":{"END_TO_END_VERIFIED":"verislop.closure","IMPLEMENTED":"verislop.vscore3-materializer","LINKED":"verislop.vscore3-linker","TESTED":"verislop.vscore-campaign-unavailable","closure":"verislop.closure","semantic_edge":"verislop.vscore3-checker","structural":"verislop.bridge-preparation"},"property_fragment":"pure accepted contract DSL 0.1/0.2 over unbounded Nat/Int, Unicode scalar String, Bool, Unit, accepted nominal records, enumerations, lists, options and Result; binder-preserving function refinement; reconstructed source facets discharged by exact typed-entry and observation laws","relation_template":"vscore.reference_refinement/0.3","semantics":"vscore-semantics/0.3","target":"vscore","testing":"unsupported","tier":2},"build_policy":{"build_timeout_seconds":300,"builds":2,"kernel_timeout_seconds":300,"memory_mb":8192,"require_filesystem_isolation":true,"require_network_isolation":true,"total_timeout_seconds":1800},"claim_ids":["BRIDGE:implementation:vscore-refinement","BRIDGE:structure:implementation","CLOSURE:clean-builds","CLOSURE:determinism","CLOSURE:endpoint","CLOSURE:provenance","END_TO_END_VERIFIED:A1@1","END_TO_END_VERIFIED:D1@1","END_TO_END_VERIFIED:O1@1","END_TO_END_VERIFIED:O2@1","END_TO_END_VERIFIED:S1@1","END_TO_END_VERIFIED:W1@1","FORMALIZED:A1@1","FORMALIZED:D1@1","FORMALIZED:O1@1","FORMALIZED:O2@1","FORMALIZED:S1@1","FORMALIZED:W1@1","IMPLEMENTED:A1@1","IMPLEMENTED:D1@1","IMPLEMENTED:O1@1","IMPLEMENTED:O2@1","IMPLEMENTED:S1@1","IMPLEMENTED:W1@1","INTERPRETATION:request","INTERPRETED:A1@1","INTERPRETED:D1@1","INTERPRETED:O1@1","INTERPRETED:O2@1","INTERPRETED:S1@1","INTERPRETED:W1@1","LINKED:A1@1","LINKED:D1@1","LINKED:O1@1","LINKED:O2@1","LINKED:S1@1","LINKED:W1@1","PROVED:A1@1","PROVED:D1@1","PROVED:O1@1","PROVED:O2@1","PROVED:S1@1","PROVED:W1@1","REIFIED:A1@1","REIFIED:D1@1","REIFIED:O1@1","REIFIED:O2@1","REIFIED:S1@1","REIFIED:W1@1","TESTED:A1@1","TESTED:D1@1","TESTED:O1@1","TESTED:O2@1","TESTED:S1@1","TESTED:W1@1","TYPECHECKED:A1@1","TYPECHECKED:D1@1","TYPECHECKED:O1@1","TYPECHECKED:O2@1","TYPECHECKED:S1@1","TYPECHECKED:W1@1"],"claim_inventories":[{"path":"claims.json","sha256":"sha256:c5e435109b448916f6e25e3a632f6cebc4874a6626c55a0158be2257dfc0b284"},{"path":"closure/implementation-claims.json","sha256":"sha256:fb751bf6080b4eb0a858f924acc713039b2d375b61ff024a8aeba05752dd610b"}],"closure_id":"data-source-tier2-fixture-closure-93d53acb96957c6b3e5aecea","endpoint":"restricted_source","format":"verislop.closure-plan/0.2","permitted_nondeterministic_fields":["/execution/attempt_id","/execution/started_at","/execution/finished_at","/execution/wall_ms","/execution/work_directory","/evidence/evidence_id","/evidence/raw_result_ref","/evidence/raw_result_hash","/raw/sequence","/raw/recorded_at"],"premise_graph":[{"claim_id":"BRIDGE:implementation:vscore-refinement","premises":["BRIDGE:structure:implementation"]},{"claim_id":"BRIDGE:structure:implementation","premises":[]},{"claim_id":"CLOSURE:clean-builds","premises":[]},{"claim_id":"CLOSURE:determinism","premises":[]},{"claim_id":"CLOSURE:endpoint","premises":[]},{"claim_id":"CLOSURE:provenance","premises":[]},{"claim_id":"END_TO_END_VERIFIED:A1@1","premises":[]},{"claim_id":"END_TO_END_VERIFIED:D1@1","premises":[]},{"claim_id":"END_TO_END_VERIFIED:O1@1","premises":["BRIDGE:implementation:vscore-refinement","CLOSURE:clean-builds","CLOSURE:determinism","CLOSURE:endpoint","CLOSURE:provenance","IMPLEMENTED:D1@1","IMPLEMENTED:O1@1","LINKED:D1@1","LINKED:O1@1","PROVED:O1@1"]},{"claim_id":"END_TO_END_VERIFIED:O2@1","premises":["BRIDGE:implementation:vscore-refinement","CLOSURE:clean-builds","CLOSURE:determinism","CLOSURE:endpoint","CLOSURE:provenance","IMPLEMENTED:D1@1","IMPLEMENTED:O2@1","LINKED:D1@1","LINKED:O2@1","PROVED:O2@1"]},{"claim_id":"END_TO_END_VERIFIED:S1@1","premises":["BRIDGE:implementation:vscore-refinement","CLOSURE:clean-builds","CLOSURE:determinism","CLOSURE:endpoint","CLOSURE:provenance","IMPLEMENTED:D1@1","IMPLEMENTED:S1@1","LINKED:D1@1","LINKED:S1@1","PROVED:S1@1"]},{"claim_id":"END_TO_END_VERIFIED:W1@1","premises":[]},{"claim_id":"FORMALIZED:A1@1","premises":["INTERPRETED:A1@1"]},{"claim_id":"FORMALIZED:D1@1","premises":["INTERPRETED:D1@1"]},{"claim_id":"FORMALIZED:O1@1","premises":["INTERPRETED:O1@1"]},{"claim_id":"FORMALIZED:O2@1","premises":["INTERPRETED:O2@1"]},{"claim_id":"FORMALIZED:S1@1","premises":["INTERPRETED:S1@1"]},{"claim_id":"FORMALIZED:W1@1","premises":["INTERPRETED:W1@1"]},{"claim_id":"IMPLEMENTED:A1@1","premises":[]},{"claim_id":"IMPLEMENTED:D1@1","premises":["INTERPRETED:D1@1"]},{"claim_id":"IMPLEMENTED:O1@1","premises":["INTERPRETED:O1@1"]},{"claim_id":"IMPLEMENTED:O2@1","premises":["INTERPRETED:O2@1"]},{"claim_id":"IMPLEMENTED:S1@1","premises":["INTERPRETED:S1@1"]},{"claim_id":"IMPLEMENTED:W1@1","premises":[]},{"claim_id":"INTERPRETATION:request","premises":[]},{"claim_id":"INTERPRETED:A1@1","premises":[]},{"claim_id":"INTERPRETED:D1@1","premises":[]},{"claim_id":"INTERPRETED:O1@1","premises":[]},{"claim_id":"INTERPRETED:O2@1","premises":[]},{"claim_id":"INTERPRETED:S1@1","premises":[]},{"claim_id":"INTERPRETED:W1@1","premises":[]},{"claim_id":"LINKED:A1@1","premises":[]},{"claim_id":"LINKED:D1@1","premises":["IMPLEMENTED:D1@1","TYPECHECKED:D1@1"]},{"claim_id":"LINKED:O1@1","premises":["IMPLEMENTED:O1@1","TYPECHECKED:O1@1"]},{"claim_id":"LINKED:O2@1","premises":["IMPLEMENTED:O2@1","TYPECHECKED:O2@1"]},{"claim_id":"LINKED:S1@1","premises":["IMPLEMENTED:S1@1","TYPECHECKED:S1@1"]},{"claim_id":"LINKED:W1@1","premises":[]},{"claim_id":"PROVED:A1@1","premises":["TYPECHECKED:A1@1"]},{"claim_id":"PROVED:D1@1","premises":["TYPECHECKED:D1@1"]},{"claim_id":"PROVED:O1@1","premises":["TYPECHECKED:O1@1"]},{"claim_id":"PROVED:O2@1","premises":["TYPECHECKED:O2@1"]},{"claim_id":"PROVED:S1@1","premises":["TYPECHECKED:S1@1"]},{"claim_id":"PROVED:W1@1","premises":["TYPECHECKED:W1@1"]},{"claim_id":"REIFIED:A1@1","premises":["TYPECHECKED:A1@1"]},{"claim_id":"REIFIED:D1@1","premises":["TYPECHECKED:D1@1"]},{"claim_id":"REIFIED:O1@1","premises":["TYPECHECKED:O1@1"]},{"claim_id":"REIFIED:O2@1","premises":["TYPECHECKED:O2@1"]},{"claim_id":"REIFIED:S1@1","premises":["TYPECHECKED:S1@1"]},{"claim_id":"REIFIED:W1@1","premises":["TYPECHECKED:W1@1"]},{"claim_id":"TESTED:A1@1","premises":[]},{"claim_id":"TESTED:D1@1","premises":[]},{"claim_id":"TESTED:O1@1","premises":["IMPLEMENTED:O1@1","TYPECHECKED:O1@1"]},{"claim_id":"TESTED:O2@1","premises":["IMPLEMENTED:O2@1","TYPECHECKED:O2@1"]},{"claim_id":"TESTED:S1@1","premises":["IMPLEMENTED:S1@1","TYPECHECKED:S1@1"]},{"claim_id":"TESTED:W1@1","premises":[]},{"claim_id":"TYPECHECKED:A1@1","premises":["FORMALIZED:A1@1"]},{"claim_id":"TYPECHECKED:D1@1","premises":["FORMALIZED:D1@1"]},{"claim_id":"TYPECHECKED:O1@1","premises":["FORMALIZED:O1@1"]},{"claim_id":"TYPECHECKED:O2@1","premises":["FORMALIZED:O2@1"]},{"claim_id":"TYPECHECKED:S1@1","premises":["FORMALIZED:S1@1"]},{"claim_id":"TYPECHECKED:W1@1","premises":["FORMALIZED:W1@1"]}],"public_claims":[{"claim_id":"BRIDGE:implementation:vscore-refinement","obligation":null,"scope":["restricted_source; vscore/0.3","vscore-semantics/0.3"]},{"claim_id":"BRIDGE:structure:implementation","obligation":null,"scope":["restricted_source; vscore/0.3","vscore-semantics/0.3"]},{"claim_id":"CLOSURE:clean-builds","obligation":null,"scope":["restricted_source; vscore/0.3","vscore-semantics/0.3"]},{"claim_id":"CLOSURE:determinism","obligation":null,"scope":["restricted_source; vscore/0.3","vscore-semantics/0.3"]},{"claim_id":"CLOSURE:endpoint","obligation":null,"scope":["restricted_source; vscore/0.3","vscore-semantics/0.3"]},{"claim_id":"CLOSURE:provenance","obligation":null,"scope":["restricted_source; vscore/0.3","vscore-semantics/0.3"]},{"claim_id":"END_TO_END_VERIFIED:O1@1","obligation":"O1","scope":["restricted_source; vscore/0.3","vscore-semantics/0.3"]},{"claim_id":"END_TO_END_VERIFIED:O2@1","obligation":"O2","scope":["restricted_source; vscore/0.3","vscore-semantics/0.3"]},{"claim_id":"END_TO_END_VERIFIED:S1@1","obligation":"S1","scope":["restricted_source; vscore/0.3","vscore-semantics/0.3"]},{"claim_id":"FORMALIZED:A1@1","obligation":"A1","scope":["all mathematical inputs under VSCore 0.3 semantics"]},{"claim_id":"FORMALIZED:D1@1","obligation":"D1","scope":["all mathematical inputs under VSCore 0.3 semantics"]},{"claim_id":"FORMALIZED:O1@1","obligation":"O1","scope":["all mathematical inputs under VSCore 0.3 semantics"]},{"claim_id":"FORMALIZED:O2@1","obligation":"O2","scope":["all mathematical inputs under VSCore 0.3 semantics"]},{"claim_id":"FORMALIZED:S1@1","obligation":"S1","scope":["all mathematical inputs under VSCore 0.3 semantics"]},{"claim_id":"FORMALIZED:W1@1","obligation":"W1","scope":["all mathematical inputs under VSCore 0.3 semantics"]},{"claim_id":"IMPLEMENTED:D1@1","obligation":"D1","scope":["restricted_source; vscore/0.3","vscore-semantics/0.3"]},{"claim_id":